{
  "schema_version": "2.0",
  "role": "pdlc-prd-reviewer",
  "subject_digest": "SHA256_ПРОВЕРЯЕМОГО_ПАКЕТА",
  "verdict": "blocked",
  "checked_ids": [],
  "findings": [
    {
      "id": "F-001",
      "severity": "blocking",
      "entity_ids": [],
      "category": "intent_gap",
      "evidence": [],
      "explanation": "Причина с фактическим наблюдением",
      "suggested_return": "ai-prd"
    }
  ]
}
